{
  "schemaVersion": 1,
  "repository": {
    "head": "REPLACE_WITH_GIT_SHA",
    "branch": "REPLACE_WITH_BRANCH"
  },
  "baseline": {
    "jdk": null,
    "evidence": []
  },
  "goals": [
    {
      "id": "GOAL-001",
      "stage": "audit",
      "status": "PENDING",
      "dependencies": [],
      "acceptance": [],
      "report": null,
      "evidence": [],
      "authorization": {
        "reportWrite": false,
        "sourceEdit": false,
        "riskyTests": false,
        "deploy": false,
        "approvalReference": null
      },
      "objective": "Inventory JVM, Spark, Scala and runtime versions with evidence",
      "preconditions": [
        "Repository is accessible"
      ],
      "actions": [
        "Inspect build files, CI and runtime configuration without source edits"
      ],
      "rollback": "No source changes; restore report only if explicitly authorized"
    },
    {
      "id": "GOAL-002",
      "stage": "decide",
      "status": "PENDING",
      "dependencies": [
        "GOAL-001"
      ],
      "acceptance": [],
      "report": null,
      "evidence": [],
      "authorization": {
        "reportWrite": false,
        "sourceEdit": false,
        "riskyTests": false,
        "deploy": false,
        "approvalReference": null
      },
      "objective": "Evaluate supported JDK targets against Spark and Scala compatibility",
      "preconditions": [
        "Audit evidence available"
      ],
      "actions": [
        "Document compatibility constraints and authoritative sources"
      ],
      "rollback": "Revert decision document if needed"
    },
    {
      "id": "GOAL-003",
      "stage": "plan",
      "status": "PENDING",
      "dependencies": [
        "GOAL-002"
      ],
      "acceptance": [
        {
          "criterion": "For this batch, persist an impact/coverage map with selected existing tests, justified additions and baseline/target execution requirements; document any conclusion that no critical impact was found",
          "result": "NOT_RUN",
          "evidence": []
        }
      ],
      "report": null,
      "evidence": [],
      "authorization": {
        "reportWrite": false,
        "sourceEdit": false,
        "riskyTests": false,
        "deploy": false,
        "approvalReference": null
      },
      "objective": "Define reversible migration batches and acceptance gates",
      "preconditions": [
        "Compatibility decision available"
      ],
      "actions": [
        "Specify scope, tests and rollback per batch",
        "Map actual critical dependency/JDK impacts to application contracts, existing coverage and only the missing tests"
      ],
      "rollback": "Revert plan document if needed"
    },
    {
      "id": "GOAL-004",
      "stage": "apply",
      "status": "PENDING",
      "dependencies": [
        "GOAL-003"
      ],
      "acceptance": [],
      "report": null,
      "evidence": [],
      "authorization": {
        "reportWrite": false,
        "sourceEdit": false,
        "riskyTests": false,
        "deploy": false,
        "approvalReference": null
      },
      "objective": "Implement only an explicitly approved migration batch",
      "preconditions": [
        "Approval reference recorded for batch"
      ],
      "actions": [
        "Add approved missing regression tests on a dedicated feature branch in a separate commit and capture baseline results before the dependency update where possible",
        "Apply approved migration changes on the dedicated feature branch"
      ],
      "rollback": "Revert approved batch commit after authorization"
    },
    {
      "id": "GOAL-005",
      "stage": "validate",
      "status": "PENDING",
      "dependencies": [
        "GOAL-004"
      ],
      "acceptance": [
        {
          "criterion": "Every identified critical behavioral risk is covered by equivalent executed baseline/target checks with evidence; report differences and unresolved gaps, or substantiate that no critical impact was found",
          "result": "NOT_RUN",
          "evidence": []
        }
      ],
      "report": null,
      "evidence": [],
      "authorization": {
        "reportWrite": false,
        "sourceEdit": false,
        "riskyTests": false,
        "deploy": false,
        "approvalReference": null
      },
      "objective": "Compare migrated behavior with Java 11 baseline",
      "preconditions": [
        "Baseline and implemented batch available"
      ],
      "actions": [
        "Run authorized tests and document evidence-backed Go/No-Go"
      ],
      "rollback": "Restore prior runtime configuration after authorization"
    }
  ]
}
